{
  "registry_version": "0.1.0",
  "status": "working_draft",
  "source_format": "macslu",
  "vehicle_domain": "车载控制",
  "canonical_schema_file": "vehicle_api_schema.v0.1.0.json",
  "canonical_registry_file": "vehicle_api_registry.v0.1.0.json",
  "mapping_outcomes": [
    "mapped",
    "ambiguous",
    "unsupported",
    "needs_context"
  ],
  "reason_codes": {
    "mapped": [],
    "ambiguous": [
      "source_annotation_conflict",
      "mixed_domain_example",
      "multi_domain_per_intent",
      "unexpected_source_slot",
      "unrecognized_source_value",
      "multiple_normalizations",
      "multiple_mapping_rules",
      "multiple_outcome_rules",
      "unconsumed_executable_slot",
      "no_mapping_rule",
      "missing_emission_value",
      "canonical_schema_validation_failed"
    ],
    "unsupported": [
      "function_outside_schema"
    ],
    "needs_context": [
      "missing_entity_context",
      "missing_required_argument"
    ]
  },
  "executable_slot_names": [
    "intent",
    "操作",
    "对象",
    "调节内容",
    "value",
    "位置",
    "对象功能",
    "操作_concrete",
    "模式",
    "功能",
    "车机模块",
    "页面",
    "车内灯类型",
    "车外灯类型",
    "子功能",
    "方向偏移量",
    "音效",
    "摄像头模式",
    "座椅记忆位置",
    "身体位置",
    "序列号",
    "车机来源"
  ],
  "normalizers": [
    {
      "id": "intent.body_control",
      "stage": 1,
      "input": {
        "path": "intent",
        "values": [
          "车身控制"
        ]
      },
      "emit": {
        "intent_class": "body_control"
      }
    },
    {
      "id": "intent.information_fragment",
      "stage": 1,
      "input": {
        "path": "intent",
        "values": [
          "提供信息"
        ]
      },
      "emit": {
        "intent_class": "information_fragment"
      }
    },
    {
      "id": "intent.infotainment_control",
      "stage": 1,
      "input": {
        "path": "intent",
        "values": [
          "车机控制"
        ]
      },
      "emit": {
        "intent_class": "infotainment_control"
      }
    },
    {
      "id": "entity.hvac",
      "stage": 1,
      "input": {
        "path": "slots.对象",
        "values": [
          "空调",
          "车辆空调"
        ]
      },
      "emit": {
        "entity": "hvac"
      }
    },
    {
      "id": "entity.window",
      "stage": 1,
      "input": {
        "path": "slots.对象",
        "values": [
          "车窗",
          "窗户",
          "窗",
          "窗子",
          "车窗玻璃",
          "玻璃窗"
        ]
      },
      "emit": {
        "entity": "window"
      }
    },
    {
      "id": "entity.sunroof",
      "stage": 1,
      "input": {
        "path": "slots.对象",
        "values": [
          "天窗",
          "太阳窗",
          "玻璃天窗",
          "车顶天窗"
        ]
      },
      "emit": {
        "entity": "sunroof"
      }
    },
    {
      "id": "entity.sunshade",
      "stage": 1,
      "input": {
        "path": "slots.对象",
        "values": [
          "遮阳帘",
          "电动遮阳帘",
          "窗帘",
          "遮光帘"
        ]
      },
      "emit": {
        "entity": "sunshade"
      }
    },
    {
      "id": "entity.seat",
      "stage": 1,
      "input": {
        "path": "slots.对象",
        "values": [
          "座椅",
          "座位",
          "椅",
          "椅子"
        ]
      },
      "emit": {
        "entity": "seat"
      }
    },
    {
      "id": "feature.seat_ventilation",
      "stage": 1,
      "input": {
        "path": "slots.对象功能",
        "values": [
          "通风",
          "通风模式"
        ]
      },
      "emit": {
        "feature": "ventilation"
      }
    },
    {
      "id": "feature.seat_heating",
      "stage": 1,
      "input": {
        "path": "slots.对象功能",
        "values": [
          "加热",
          "变热"
        ]
      },
      "emit": {
        "feature": "heating"
      }
    },
    {
      "id": "feature.seat_massage",
      "stage": 1,
      "input": {
        "path": "slots.对象功能",
        "values": [
          "按摩",
          "按摩功能"
        ]
      },
      "emit": {
        "feature": "massage"
      }
    },
    {
      "id": "property.temperature",
      "stage": 1,
      "input": {
        "path": "slots.调节内容",
        "values": [
          "温度"
        ]
      },
      "emit": {
        "property": "temperature"
      }
    },
    {
      "id": "property.fan_speed",
      "stage": 1,
      "input": {
        "path": "slots.调节内容",
        "values": [
          "风量",
          "风速",
          "风力",
          "风",
          "出风量"
        ]
      },
      "emit": {
        "property": "fan_speed"
      }
    },
    {
      "id": "property.amplitude",
      "stage": 1,
      "input": {
        "path": "slots.调节内容",
        "values": [
          "幅度"
        ]
      },
      "emit": {
        "property": "amplitude"
      }
    },
    {
      "id": "operator.activate",
      "stage": 1,
      "input": {
        "path": "slots.操作",
        "values": [
          "打开",
          "开启",
          "开",
          "启动",
          "启用",
          "开一下",
          "打开一下",
          "开开",
          "启动一下",
          "开启一下"
        ]
      },
      "emit": {
        "operator": "activate"
      }
    },
    {
      "id": "operator.deactivate",
      "stage": 1,
      "input": {
        "path": "slots.操作",
        "values": [
          "关闭",
          "关掉",
          "关",
          "关一下",
          "关闭一下",
          "关了",
          "关上",
          "关下"
        ]
      },
      "emit": {
        "operator": "deactivate"
      }
    },
    {
      "id": "operator.set",
      "stage": 1,
      "input": {
        "path": "slots.操作",
        "values": [
          "调",
          "调节",
          "设置",
          "调到",
          "设置为",
          "设为",
          "调整",
          "调为",
          "调成",
          "调至",
          "设置到",
          "调整到"
        ]
      },
      "emit": {
        "operator": "set"
      }
    },
    {
      "id": "operator_modifier.assignment",
      "stage": 1,
      "input": {
        "path": "slots.操作_concrete",
        "values": [
          "到",
          "为",
          "成",
          "至"
        ]
      },
      "emit": {
        "operator_modifier": "assignment"
      }
    },
    {
      "id": "zone.driver",
      "stage": 2,
      "input": {
        "path": "slots.位置",
        "values": [
          "主驾",
          "主驾驶",
          "驾驶位",
          "驾驶座",
          "驾驶员",
          "驾驶席",
          "司机",
          "司机位"
        ]
      },
      "emit": {
        "zone": "driver"
      }
    },
    {
      "id": "zone.front_passenger",
      "stage": 2,
      "input": {
        "path": "slots.位置",
        "values": [
          "副驾",
          "副驾驶",
          "副驾座",
          "副驾驶座位",
          "副驾座位"
        ]
      },
      "emit": {
        "zone": "front_passenger"
      }
    },
    {
      "id": "zone.all",
      "stage": 2,
      "input": {
        "path": "slots.位置",
        "values": [
          "所有",
          "全部",
          "全车",
          "整车",
          "all",
          "ALL"
        ]
      },
      "emit": {
        "zone": "all"
      }
    },
    {
      "id": "zone.hvac_rear",
      "stage": 2,
      "requires": {
        "entity": "hvac"
      },
      "input": {
        "path": "slots.位置",
        "values": [
          "后排",
          "后座",
          "第二排",
          "二排"
        ]
      },
      "emit": {
        "zone": "rear"
      }
    },
    {
      "id": "zone.window_rear_left",
      "stage": 2,
      "requires": {
        "entity": "window"
      },
      "input": {
        "path": "slots.位置",
        "values": [
          "左后",
          "后左",
          "左后座",
          "左后侧"
        ]
      },
      "emit": {
        "zone": "rear_left"
      }
    },
    {
      "id": "zone.window_rear_right",
      "stage": 2,
      "requires": {
        "entity": "window"
      },
      "input": {
        "path": "slots.位置",
        "values": [
          "右后",
          "后右",
          "右后座",
          "右后侧"
        ]
      },
      "emit": {
        "zone": "rear_right"
      }
    },
    {
      "id": "zone.window_front_row",
      "stage": 2,
      "requires": {
        "entity": "window"
      },
      "input": {
        "path": "slots.位置",
        "values": [
          "前排",
          "前排前排",
          "主副驾",
          "主驾副驾",
          "主驾和副驾"
        ]
      },
      "emit": {
        "zone": "front_row"
      }
    },
    {
      "id": "zone.window_all",
      "stage": 2,
      "requires": {
        "entity": "window"
      },
      "input": {
        "path": "slots.位置",
        "values": [
          "四个",
          "四门"
        ]
      },
      "emit": {
        "zone": "all"
      }
    },
    {
      "id": "zone.window_rear_row",
      "stage": 2,
      "requires": {
        "entity": "window"
      },
      "input": {
        "path": "slots.位置",
        "values": [
          "后排",
          "后座",
          "第二排",
          "二排"
        ]
      },
      "emit": {
        "zone": "rear_row"
      }
    },
    {
      "id": "zone.window_left_side",
      "stage": 2,
      "requires": {
        "entity": "window"
      },
      "input": {
        "path": "slots.位置",
        "values": [
          "左",
          "左侧",
          "左边"
        ]
      },
      "emit": {
        "zone": "left_side"
      }
    },
    {
      "id": "zone.window_right_side",
      "stage": 2,
      "requires": {
        "entity": "window"
      },
      "input": {
        "path": "slots.位置",
        "values": [
          "右",
          "右侧",
          "右边"
        ]
      },
      "emit": {
        "zone": "right_side"
      }
    },
    {
      "id": "zone.seat_rear_left",
      "stage": 2,
      "requires": {
        "entity": "seat"
      },
      "input": {
        "path": "slots.位置",
        "values": [
          "左后",
          "后左",
          "左后座",
          "左后侧"
        ]
      },
      "emit": {
        "zone": "rear_left"
      }
    },
    {
      "id": "zone.seat_rear_right",
      "stage": 2,
      "requires": {
        "entity": "seat"
      },